,Text,ZPatient,ZGender,ZAge,NPatient,NGender,NAge,DisagrPat,DisagrGen,DisagrAge,AgeExpl
360,History of thyroid cancer plus dfsp and family history of anaplastic thyroid cancer intense pain at night What to do next I have the weirdest thing happening now I had stage 3 papillary thyroid cancer a decade ago in remission till now But recently the left side of my throat has begun to hurt Specifically a Dull jabbing Gradually increasing constricting Pain on left side of trachea Lowest level almost non existent during waking hours But increases as relaxetion increases while drifting off to sleep Wakes up due to high level of pain But subsides when fully awake No change in posture or any such thing affects it When this pain got worse in dec a lot of lymph nodes on the left chin side swelled up and next to my left spine They have stayed swollen Iodine scan was negativeTg levels are slightly elevated and should not be due to not having a thyroid anymore Had thyroidectomy for first treatment a decade ago Doc ordered an MRI but it says nothing of recurrence although it mentions the swollen lymph nodes Pain is pretty intense and I wake up every night at 3 4 am due to that Doc just,2,0,5,1,0,2,1,0,1,0
361,Liver cancer pain Hi So I was originally diagnosed with breast cancer 4 years ago I beat it but when I went in to see my surgeon to have my port removed she found a small cancerous bump on my chest wall It turns out the cancer is back and has spread to my lungs bones liver and some other places For the last two weeks I've had incredible pain in my liver I was taking only oxycodone and my doctor put me on a fentanyl patch It worked okay I still felt a lot of pain though I'm having a cat scan tomorrow to determine what's going on Right now I'm wearing the patch and taking oxycodone and I feel almost no pain relief I think my liver is failing I'm scared I don't want to go to the hospital Is there anyone out there going though this that can give me some advice I'm looking for a way to treat this pain without having to take more medicine Every time I bring a new script to my pharmacy they balk at filling it and really give me a hard time I explained that I am terminal and my,2,0,7,1,0,0,1,0,1,0
362,My friend died today My friend died of cancer today Why would a god allow such a sweet and loving person die like this Fuck this god,2,0,0,2,0,0,0,0,0,0
363,Side effects from chemo for small cell lung cancer Hello I'm new to this sub my husband was recently diagnosed He just finished his first three consecutive days of chemo on Friday they are giving him carboplatin and etoposide He is sleeping a lot like 16 hours a day This morning he woke up around 1030 with a sore throat that wasn't among the numerous possible side effects they mentioned He doesn't want me to call the oncology team on a Sunday but I'm a bit worried He sustained a lot of lung damage from Agent Orange exposure in Vietnam and has COPD The last thing he needs right now is a cold flu or strep throat He's still recovering from having a section of his upper right lobe removed Does anyone know if a sore throat is a common side effect His temp is 99 and hasn't climbed at all so maybe I'm just paranoid but I can't help it I want him to be ok,2,2,8,2,2,9,0,0,1,0
364,CAR T Cell therapy and Adult B Cell ALL My husband (39) was diagnosed with B Cell ALL in December He has finished round 1 of induction and is currently on round 2 He will do his consolidation chemo over the next 4 to 5 weeks after this round is over Then he is supposed to go on to the same induction consolidation cycle over again So far he has been negative for spinal and brain invasion but his most recent bone marrow biopsy did show pockets of blasts 0 049% on the Flow cytology where they of course really wanted to see 0% Since his genetic profile is hyperdiploid (good) the doctors were pretty confident that chemo would knock the ALL out without a transplant awesome news But now with that remaining 0 049% there is conversation around options should this induction cycle not produce the results they want i e 0% on the Flow cytometry Transplant is the option we are really hoping to avoid if possible and one of the oncologists mentioned a clinical trial going on involving CAR T cells We are at a top tier research hospital so if we do have to go that,2,2,2,2,2,2,0,0,0,1
365,SO of eight years with Synovial Sarcoma Hey Reddit November 2016 the love of my life was found to have a large mass on her upper left lung A couple more scans and a biopsy revealed it was cancerous A few days later her surgeons removed the tumor with clear margins but there was a spill during the procedure that her cancer team was concerned about PET scan showed no other lesions in her body Three months later she begin post surgery proton beam therapy to help reduce the chances of recurrence in her lung Two months later she begin chemotherapy but because she had a very immediate and abnormal reaction to the drugs (confusion and hallucinations) they stopped treatment We were told by her oncologist that alternative drug combinations had no statistical benefit so we discontinued treatment Fast forward to October 2017 a CT scan revealed another large mass in her lower left lung that remained undetected in previous scans because it was hidden behind fluid and blood accumulation from the radiation she had earlier in the year A few weeks later she began proton beam radiation to shrink and help prevent another spill when they do surgery after,2,1,5,2,1,0,0,0,1,0
366,A worse person after cancer Everybody I know says I am angry and bitter and I believe them Before I had cancer I was kind and patient and I guess Im not now Its hard to know when you are the person whose changed I just want to change back or to a good person I want to be a person who is grateful for being alive and being given another day to live Do any of you have similar feelings of becoming a worse person after cancer Or if you havent how do you be a positive person,1,0,0,1,0,0,0,0,0,0
367,My father just found out his newly diagnosed prostate cancer has spread to his lymph nodes Turning something that was operable into something that is not I know nothing about this and dont know what to do Where do I go for information How serious is it I feel helpless I want my children to grow up with a grandfather,2,2,8,2,2,8,0,0,0,0
368,Edibles for a friend So I have a friend who's much older than me who asked about edibles for her chemo I live in CO and have used edibles rec style for sleep and fun but never for medical instances She is very open to the idea of high CDB edibles to help her out but said she can't take anything with estrogen or anything that convert to estrogen like Black Cohosh The info I have from her is Invasion Ductal Carcinoma ER PR Her2 Thanks guys and hope for the people in pain that you have some happy days and recover quickly ),2,1,8,2,1,7,0,0,1,0
369,How did you cope while you were waiting for your diagnosis Ive been having episodes of very severe headaches for the past month and a half At first I thought it was due to my crappy holiday season and family being over causing lots of stress so I took it easy tried to manage my tension better and cleaned up my sleeping habits It didnt work Then I began having other symptoms like dizziness lightheadedness confusion extremely hard time focusing so on so forth I was feeling pretty shitty and no amount of home remedies worked Last week I finally got sick of it and made an appointment with the doctor He did a full neurological exam and checked the back of my eyes He says I have papilledema which indicates increased intracranial pressure which in turn means theres probably something inside my head My family doesnt have a generalized history of cancer but my grandmother recently died of ovarian cancer and it left me with a veritable horror of somehow ending up with it My doctor ordered a CT scan to see whats happening but Im waiting for my insurance company to authorize it before I go in Then,1,0,7,1,0,0,0,0,1,0
370,Chances of me having Lung Cancer I'm a 21yo male I smoked for like a month many years ago and never did again recently i started having back and shoulder pain it's not bad it's just annoying i don't cough blood or have breathing problems or any of the other symtoms of lung cancer am i being paranoid should i stop reading about symtoms online thanks in advance,1,2,2,1,2,2,0,0,0,1
371,Does anybody else get less relief from the pill tablet forms of painkillers (especially oxycodone) Alright so the background for this is sort of long and VERY aggravating so Ill stick to the point I take a lot of pain medication Motrin tablets twice a day liquid oxycodone every 3 hours morphine extended release tablets every 12 and if you count it marinol twice within every 24 Out of these meds the oxycodone and the Motrin are significantly less effective at getting rid of pain when I take the tablet versions Im fine with taking the Motrin pills because theyre not as important to me but the oxycodone does not work AT ALL when I take the pill form I actually end up with withdrawal I have no idea why this happens but it is super inconvenient I have to take oxycodone through a g tube so if I want my scheduled pain relief I have to lug around a massive bottle of suspicious narcotics 3 syringes a container for water and a connector tube This also means instead of just popping pills and being done I have to set up a sort of mini shop just to freaking take,1,0,1,1,0,1,0,0,0,1
372,Exhaustion post chemo I had my last chemo (R CVP) on January 12th and the results of my scan were clear (thankfully) However I've really been struggling with exhaustion as of late Has anyone else found that their exhaustion got worse after treatment I know that it will take time to stop feeling so exhausted and I didn't expect to go back to normal right away I just assumed I would slowly start to feel better improve I know that of course this could just be life work etc but would like to hear from others,1,0,7,1,0,0,0,0,1,0
373,It's been one year since my Dad's initial diagnosis of lymphoma We lost him in July 7 months later and every single day is infinitely harder knowing I'll never see him again Time will heal all wounds except this one it seems I just wish it were me instead of him,2,2,7,2,2,8,0,0,1,0
374,Anyone who may be in need of a wig Long story short my mother was diagnosed with stage 4 lung cancer in March 2017 Went through chemo brain tumor developed tumor removed she passed from complications in October 2017 During her first month of treatments I got her a really nice wig She never lost enough hair to use it I think I'm now to the point of where I can give someone who needs and could use the wig I know my mom would approve and love the idea of me helping someone with cancer out but I'm leery of just giving the wig away It's a pretty expensive piece and I'm skeptical of just handing it over to someone I live in the Cincinnati Dayton area and would love to give this piece to someone and take them out for a meal I'm hoping someone here has some ideas on how I can do this,2,1,8,2,1,8,0,0,0,0
375,Pediatric Cancer Research Funding Hello! I am curious as to what are major barriers preventing more money being given to pediatric cancer research Should local governments be directing more money Corporations I was wondering if anyone could give me their first hand perspective on this issue Thank you in advance!,0,0,0,0,0,0,0,0,0,0
376,Lymphoma What were your symptoms Hi everyone I hope yous are doing well For over a month now I've had swollen lymph nodes (one under jaw and another back of head) I had a really bad case of the flu at christmas but I'm fully recovered now I have been for bloods (everything came back normal) and have a referral to an ENT if I feel I want to go I just want some input before I decide to do that My swollen glands aren't too big (maybe the size of my finger tip) How big were yours before you sought out any treatment I dont have any other symptoms I feel totally normal Thanks in advance!!,1,0,0,1,0,0,0,0,0,0
377,one step forward two steps back when a person shows a sign of progress towards recovery and then things suddenly turn towards the worse how do you handle it,0,0,0,0,0,0,0,0,0,0
378,Cognitive and memory tests Hi All I realized between being in a clinical trial (lucky and neat but I'd rather just be well) and failing thyroid (no surprise given my treatments) that I should be measuring my cognitive ability an memory Unfortunately I don't have any idea what some good tests are for that I have my own measures of tasks that I can perform and subjective ideas of ability from back when I was doing chemo but it's harder with slow decline improvement (I most recently felt like it was getting better after a protocol change) Anyone have any resources they liked,1,0,0,1,0,0,0,0,0,0
379,Hello all I don't know if this is the right place but I figured it would be at least a good place to start Last November my mom (74 years old) was diagnosed with brain tumors after a fall On December 1st she passed away from Central Nervous System Lymphoma From the date of the actual diagnosis it only took 22 days for that monster to take my mom Prior to the fall my mom wasn't the typical 74 year old She was extremely independant and active She was on the go all of the time and had you met her you would never have thought she was in her 70s Anyway I'm figured this might be a good place to see if there are others that have been through this with a loved one and I suppose find some sort of commonality with others What I have learned since December 1st is that CNS Lymphoma is extremely rare and (in the words of her oncologist) the most aggressive cancer known to man More importantly I've learned that there isn't a tremendous amount known about this form of cancer and treatments haven't changed a lot over the years I should,2,1,9,2,1,9,0,0,0,1
380,Lost Another Chemo Buddy Today I just can hardly take any more,1,0,0,2,0,0,1,0,0,0
381,Started FOLFOX regimine last week for colerectal cancer and I have questions for anyone who has been through it A bit about me I completed six weeks of 5FU along with radiation so I'm familiar with the some of the side effects After the first dose of FOLFOX I immediately had the joy of the cold sensitivity in my hands and throat kick in it was a hoot My main question is about fatigue I was told it would be cumulative and kick in slowly Anyone care to chime in on this Also how long did it take for any of you to get your energy back after finishing treatment I have 3 to 6 more rounds before surgery then finish the 6 month of treatment after recovery,1,0,0,1,0,0,0,0,0,0
382,My Older Brother Passed Away Yesterday Nothing feels right anymore,2,2,7,2,2,0,0,0,1,0
383,Afraid to die as we already lost my dad Granted i only have basal cell from what has been learned so far so i should be safe however because i was so afraid of cancer being diagnosed after it got my dad and how i no longer believe in chemotherapy I actually postponed my initial gp appointment a year and then after a dumb dermatologist analysed my problems i got misdiagnosed and all in all my diagnosis was postponed 3 years I got BCC and possibly SC lesions lots of places and currently discussing what to do Initial skin biopsy said it was benign but that was a year ago Now is different Haven't said to anyone in my family i have cancer only that a few months back i admitted i thought this was cancer but like i was in denial my mom does not want me to talk about my lesions even though they're on the neck so she can see it at all times She'll tell me to spend time in the sun because it heals my infection and she'll give me this disinfection cream It's really tough when you just about know it is cancer that,1,0,7,1,0,0,0,0,1,0
384,how to support partner with stage 4 melanoma My boyfriend was hospitalized early last week with a horrific headache and it turns out his melanoma from 3 years ago has come back with a vengeance in his brain He had a craniotomy to remove the largest tumor and now he's in the ICU recovering Tips on how to care for him when he comes home Craniotomy folks what did you need and want General stage 4 cancer folks what did your significant other do to make you feel better emotionally or physically Caregiver folks what did you do to stay sane We were talking about getting engaged right before this happened We moved in together 3 months ago I want to have kids with this guy Just want my baby to smile again,2,2,2,2,2,2,0,0,0,0
385,Find Out My Next Step Thursday This summer fall and winter have been hard Between getting a 3rd cancer diagnosis repeatedly hearing how I am much too young to have this many cancers without a genetic link and losing any amount of chill I have ever held onto it has been rough Now I am finding out on Thursday what happens next I don't know what I want my oncologist to say If he says I need no further treatment I am going to stress about the what ifs If he says I need radiation I am going to freak out about how sick I may get and secondary cancers If he says chemo I am going to be scared of the effects and the possible secondary illnesses I am subjecting myself to I know that whatever route I have to deal with I will I just wish there was a magic cancer fairy that could wave a wand and say you have endured enough you will be fine from now on Sadly that doesn't exist so I will stress my way through whatever is determined to be the best next course if action Thanks for letting me vent,1,0,3,1,0,3,0,0,0,0
386,My Dad just started taking Firmagon (degarelix) Does anyone have any experience with this hormone therapy My Dad is 73 and had his prostate removed about 5 years ago He recently found out that the cancer has returned in the lymph nodes around where the prostate was He started his first shot of Firmagon (degarelix) today I have a read about the side effects but I was hoping to hear from someone who has taken it or has a close family member friend that has Thanks,2,2,9,2,2,9,0,0,0,1
387,If cancer were a restaurant Officially 6 months into remission and it still sucks because chemo kicked my ass So i wanted to do something where we could all creatively vent or express our humour If cancer were a restaurant what would the yelp reviews look like,1,0,0,1,0,0,0,0,0,0
388,Head scarfs My mom is starting chemo Thursday and her birthday is in two weeks I wanted to gift her a nice beautiful scarf for when she loses her hair Any ideas,2,1,7,2,1,8,0,0,1,0
389,Testicular Cancer strange ultrasound results not sure what to think Went in to get an ultrasound on my right testicle due to feeling something which turned out to be a small cyst However they found something on my left testicle but classified it as large ill defined hypoechoic region Im going to have a urology appt scheduled but I thought most testicular cancer showed up really clear in ultrasound results not my indeterminate finding according to my doc I never noticed any differences with my left testicle It is smaller however that is mainly due to Varicocele Ive had since a kid Obviously Im pretty freaked out worried about TC that was basically in stealth mode,1,2,0,1,2,0,0,0,0,0
390,How to explain cancer reoccurrence to a child Last spring I was diagnosed with s4 stomach cancer I had to explain the situation to my 6 yo daughter She was scared Even if she didn't understand everything she saw how upset her mom was and how much weight I'd lost At the cancer center where I'm being treated they gave us a book called Talking with My Treehouse Friends about Cancer An Activity Book for Children of Parents with Cancer We read it and colored all the pages together and she asked me a lot of Qs about cancer and my health It was a great help and afterwards she was calmer and a lot more understanding especially when I was too beat up by chemo to play with her In Oct I had a PET scan that showed NED We were thrilled But I made the stupid mistake of telling my daughter that my cancer was gone I figured I would be in remission for a few years at least but it only lasted about a month The hardest part of all of this by far was having to tell my daughter that the cancer had returned Since then,1,2,5,1,2,2,0,0,1,0
391,Agony From Gastronomy PEG Tube I had a PEG installed 26 hours ago Since then I've been in agony I was meant to go home this morning but was readmitted on account of the pain I was in I'm managing it with Endone Morphine and Panadol but it barely touches the sides The surgeon took an x ray to check the position of the PEG and is happy with it but What degree and length of pain is within normal limits Will my pain end soon,1,0,0,1,0,0,0,0,0,0
392,Just diagnosed with a solid mass in the testicles What steps should I be taking to expedite my treatment and effectively self advocate I had an ultrasound today and cysts were ruled out in my diagnosis I have a precancerous or cancerous mass of 1 5 cm on my left testicle I was referred to a urologist for an office appointment on wednesday of next week but I'm afraid given my age (25) that I have a nonseminoma which is more aggressive Should I be contacting other offices that I was not referred to to try and get an earlier appointment Anyone with TC know if they conduct tumor marking at the office appointment or will I be waiting even longer for that and then surgery as well I'm just kind of a bit lost here looking for information or advice Thanks,1,2,2,1,2,2,0,0,0,1
393,No Support from Doctors Family or Friends Hi all long story short I was sick for 10 months because of a brain tumor and only started being well in October I had such horrible experiences with friends family and medical professionals being apathetic not understanding and not very helpful as I dragged myself to recovery through the trenches alone minus my husband who was my caregiver Everyone else failed me really I'm sure there are many other similar experiences how did you all relate to other people again after your journey It is such an isolating and lonely place to be and it has caused me to lose faith in humanity I'm not even trying to say that there are NO good people on earth its just that sadly strictly statistically speaking I feel like good people who are at all empathetic to others are really only 1 100 tops I am in therapy and was studying to become a therapist myself when I was diagnosed I don't like anyone or anything and don't want to do anything Everyone minus my husband really let me down How did you guys deal with this and did the feeling ever go away,1,1,2,1,0,0,0,1,1,0
394,Need some help choosing for a complete or partial armpit dissection (edema risk vs cancer risk) So my mom's just finished up chemo for breast cancer and we recently received the results The tumor has decreased with more than 85% and the 8 lymph nodes that showed as affected before chemo are now showing up clean on the post chemo scan Due to the amount of nodes that were affected and the initial tumor size the protocol is still a full mastectomy plus armpit dissection But they are giving us two options Remove all lymph nodes (more edema risk) Remove just 5 6 nodes test during surgery remove rest if showing positive for suspicious activity If they show negative they will do a more thorough test and there's still a possibility of a secondary surgery She will get radiation either way They are giving us the choice because as per this year the protocol changed from the first option to the second option (In the netherlands at least)So scenario one has a larger chance of edema but when you go for option two you're never 100% sure that all affected nodes have been removed (even though they will still receive,2,1,8,2,1,8,0,0,0,0
395,Its been almost a month since my friend died She had been battling stage IV triple negative breast cancer for a little over a year after being in remission for three years First it was a lump on her sternum Then nodules on her lungs Then lesions on her spine She was going to be treated with immunotherapy I thought it would buy her more time Then she died on January 15 4 days after going into hospice She had a husband a one year old son We had been friends since we were 2 She was 27 Fuck cancer,2,1,2,2,1,2,0,0,0,1
396,Need help processing Hi im a 17 y o from the Netherlands My grandpa has braincancer and in his lymph nodes He has been declared incurable and is now in his last week on earth since he will be euthanised this week He is completely drugged on Morphine and he lost control in both his arms He cant speak any comprehansive sentences anymore I cant hug him I cant talk with him I cant laugh with him I even find it hard to step by to check on him since its hard to imagine that person there is my grandpa It just doesnt feel like him anymore What is the best i can do in this scenario,2,2,8,2,2,9,0,0,1,0
397,First Post Op Scan Results I received the results for my first post op scan today (liver resection oct 2017) Doc says everything looks good! There is a slight shadow still in the liver but they arent sure if its anything to worry about and says we will just keep an eye on it Its possibly scar tissue from the surgery So 3 more months of FOLFIRI and then an MRI If the MRI is all clear he says we can stop chemo and see what happens! DMaybe after two years of this crap my life can go back to being somewhat normal As for now still on a LOA from work and disability,1,0,5,1,0,7,0,0,1,0
398,My dad was just diagnosed with either renal cancer I don't kniw what to do I was called my my brother while i was on shift an hour ago and he told me dad's been diagnosed with cancer and i don't know what to do I feel like bawling my eyes out i don't want my dad to die please can someone talk to me,2,2,7,2,2,8,0,0,1,0
