,Text,ZPatient,ZGender,ZAge,NPatient,NGender,NAge,DisagrPat,DisagrGen,DisagrAge,AgeExpl
184,Peer reviewed paper supports ketogenic diet turns immune system against tumors immune system is regulated by the tumor micro environment An acidic hypoxic environment will disable the immune system's ability to see the tumor as the enemy A ketogenic diet helps create a friendly micro environment that promotes cytotoxic T cells to attack and destroy the tumor,0,0,0,0,0,0,0,0,0,0
185,Stage IV colon cancer at 26yo I'm looking for someone with a simular story as mine to share prognosis experiences to treatment studies and whatnot I got diagnosed with stage IV colon cancer when I was 26 For me there is no other treatment than chemo until that no longer works Had surgery been on chemo for almost 2 years now Sooo yep that's me,1,0,2,1,0,2,0,0,0,1
186,Risks of Cannabis Use (edibles) Hi everyone ) my dad was recently diagnosed with AML and is currently dealing with a nasty fungal infection he picked up after his second round of chemo Hes out of the hospital and very slowly recovering his white blood cell counts and neutrophils While he was deemed to be in remission after the first round of chemo unfortunately hes experiencing terrible and persist nausea likely as a result of the antibiotics that hes currently on As a result hes lost a significant amount of weight Hes on a cocktail of drugs including Zofran Marinol and a scolpamine patch He occasionally takes Adavan but he doesnt like to because it makes him disoriented and pretty out of it for at least several hours I have a couple of questions the first one more generally do you guys have any particular for managing hard to manage nausea The stuff hes on so far sooort of works but hes still vomiting somewhat regularly and Id really like to explore some different options Which takes me to my next question do you think edible cannabis marijuana products would be safe for him to consume We understand the risk,2,2,8,2,2,8,0,0,0,0
187,Lets talk cancer and sex How has sex changed for you since your diagnosis,0,0,0,0,0,0,0,0,0,0
188,Can I cooked egg and chicken in cancer Hello good people of Reddit Can I eat cooked egg and chicken if I have cancer I have melanotic xp11 translocation associated clear cell tumor It was found ureter not touching the kidney and was removed It has been 7 months and CT scans show nothing Tumor was small 2 25 cm only,1,0,0,1,0,0,0,0,0,0
189,Folfox experiences My mother has her first mop up Folfox treatment for her rectal cancer today Can anyone tell me their experience with it Shes horrified and so am I,2,1,7,2,1,8,0,0,1,0
190,Help me understand Melanotic xp11 Hello My biopsy report is below Doc says it is a rare type of cancer Alos he says the less you know the better otherwise you will worry But it is better if I know I thought maybe someone here can help me understand it better as I live in a developing country If someone can ask their oncologist thank you Current Status Tumor was found in ureter wall but removed via laproscopy Its been 7 months now CT scans are clear ==================Tumor is composed of large cells with a clear cytoplasm which in many cells shows a known brown KNOH bleachable Perls' negative pigment which is melanin There is no spindled component seen nor is there evidence of perivascular arrangement Tumor cells express TFE 3 (strong nuclear positivity) They are negative for cytokeratin EMA HMB 45 Melan A S 100 protein Desmin SMA h caldesmon Pax 8 MITF inhibin Synaptophysin and Calretinin Tumor engulfing the upper ureterMelanotic Xp11 translocation associated clear cell tumor=============================,1,0,7,1,0,0,0,0,1,0
191,Hello I just found this subreddit and I wanted to share my familys story On June 10 2016 My cousin who was 10 at the time was diagnosed with Acute Myeloid Leukemia They started chemo and she went through 4 rounds before they realized it wasnt killing the cancer like it should have been if you know anything about Leukemia then you know whats coming next The doctors said the only thing to do now was a bone marrow transplant In November of 2016 she received a bone marrow transplant courtesy of her amazing mom And shes released in time for Christmas! A 100 days later shes officially in remission! Everythings going fine until September 2017 we heard something we never wanted to here; The Leukemia was back She went through mild out patient chemo and then in November 2017 she was readmitted to the hospital Shed been there for 7 months in 2016 in early November she fell unconscious and we didnt know if she was going to wake up but she did! And then on December 7 2017 my familys world came to a devastating end My amazing cousin and best friend passed away at the young age,2,1,1,2,1,1,0,0,0,1
192,Can breast cancer kill quickly and suddenly My ex wife and I were married for 18 years Five years ago we got a divorce but still stayed in touch by email On December 10th she was diagnosed with breast cancer She told me on December 14th She said they told her the breast cancer had moved into the liver and was scheduled to see an oncologist sometime after Christmas She said she may need help with bills and what not I offered to help in anyway I could On January 3rd she passed away suddenly I didn't even get a chance to say goodbye Can this really happen How can someone die so quickly if the doctors where like We'll get you in to see someone in a couple of weeks I saw a recent picture of her and I noticed she was wearing a ring on her married ring finger It wasn't a wedding ring and she had not gotten remarried since our divorce I feel devastated I know we were divorced but I feel really heart broken We were married for 18 years and we got married when I was 18 I am feeling confusion and denial I,2,1,4,2,1,4,0,0,0,0
193,Tinnitus and chemo I have tinnitus and its severe whenever am abt to sleepnit gets high pitched I was just wondering that some people get tinnitus as a side effect if chemo after the chemo sessions done the tinnitus goes away or just stays Sorry if its a stupid question My T really is annoying,1,0,0,1,0,0,0,0,0,0
194,Transferring to cancer center Is there a good time to transfer to a cancer center Someone was tested and it looks like they have cancer The results for Biopsies have not been submitted but GI said it looks like cancer My question is when is the right time to have them transferred to a cancer center Should we wait until biopsy and other tests are concluded or should we request it right away The hospital seems to be moving quickly and may want to do surgery soon if possible Any advice on what to do,2,0,0,2,0,0,0,0,0,0
195,CHD Lymphoma Anyone on here with Congenital Heart Disease and cancer I know cardiac symptoms often result from chemo but mine are pre existing Worried about the effect of chemo on my bio prosthetic pulmonary valve Thanks!,1,0,0,1,0,0,0,0,0,0
196,moms situation got more complex mom was diagnosed with cancer last year in june 2017 with Anal Cancer and months later Thyroid Cancer She went through a surgery that left a massive scar on her neck and had 11 out of 12 lymphnodes removed as well as the thyroid gland Prior to the surgery she went throught two cycles of chemo and radiation for the anal cancer Fast forward to today Thyroid area has been cleared for not having cancer although they want to give her pill that will kill any remain cancer cells The anal cancer though has now spread to an area that is between her liver and lung(some floral area) and between her ribs Since she has extreme discomfort due to her life long colitus which makes it impossible for her to have BM she is in constant level 10 pain The doctor said the next step is to do a temp colostomy and at the same time of the surgery do more biopsies on the anal cancer and finally he said after the biopsies meet with a tumor team and see what the best next move He suggested a different chemo to take care of the,2,1,7,2,1,8,0,0,1,0
197,is this site total non sense (natural treatments; beta glucan) to post that kind of site looks a bit like those people trying to make money on others' tragedies However it mentions a supplwment called beta glucan for which there are (it seems) peer reviewed studies anyone knows about it It'a supposed to improve the immune system has anyone here rejected chemiotherapy,0,0,0,0,0,0,0,0,0,0
198,What can I do Somebody I give a shit about is starting a 30 day round of radiation soon What can I do to ease that process Anything you can think of that would be nice to have while at treatment I am at work while theyre there but know its gonna suck I wanna help but Im horribly ignorant,2,0,7,2,0,0,0,0,1,0
199,Mom might have breast cancer So my mom noticed a lump in her breast that was growing She went to the doctor who has scheduled her for a mammogram and scan later this month on January 30th And then a followup doctors appointment on February 5th as the doctor is away the week she gets it done This wait feels like it has gone on forever and I am really scared that this is going to be a major problem especially with how fast it grew in the last month and a half Both my mom and I think that this has actually been in her breast for over a year and a half now An anomaly was detected when she had her last mammogram but nothing about it was brought up between her and her doctor who she visits once every three months due to her diabetes Not asking for any suggestions or anything I just really needed to write this down I'm trying not to freak out too much and i'm hoping for the best!,2,1,7,2,1,8,0,0,1,0
200,Lost My dad 50 was just diagnosed with stage 4 colon cancer with mets to the liver This comes less than a year after having prostate cancer and prostatectomy and only 2 years after a clean colonoscopy It seems unfair and I dont know what to do Im angry and Im sad My parents live in a different state and Im currently finishing up my PhD writing my dissertation and applying for jobs To say I am stressed is an understatement Part of me wants to just drop everything and be with my parents but I also feel like its the wrong thing to do The future seems so blurry and unsure Idk what the point of this post was Just stressed Angry Overwhelmed I hate cancer,2,2,4,2,2,4,0,0,0,1
201,Scared for my father My dad was having some health issues which I thought were mild atleast controllable He was going to the doctor and making changes in his lifestyle At the time we thought it was diabetes so relatively no problem More months pass and new issues pop up More doctor visits more waiting more cautious optimism that it's nothing everything will be fine I learn today less then 4 hours ago it's pancreatic cancer I spoke with my mom on the phone who had on her brave face I knew she was barely holding it together so I did not press for any extra details I know that there are treatment options Surgery might be possible or a round of chemotherapy but we won't know what the plan is for a couple of weeks So please anybody what do I do How do I act around my dad my mom 3 sisters My dad and I work together and people there asking if he is ok but no one knows anything yet I am so scared and lost Where do I start Anything thing will help Thank you all,2,2,8,2,2,8,0,0,0,0
202,Mom has cancer not that worried My mother has been in pain fairly mild stomach pain on and off the past year Finally went to see a GI as she thought she had diverticulitis and was told to see another specialist Within two days he sent her to the hospital and had surgery to remove two larger tumors on her ovaries so they did a hysterectomy She also had a large one near her colon and got some of that removed They are going to do 18 weeks of chemo to make sure they got at all I had a few tears when they told me today but I dont feel that sad I dont know if Im in shock or dont understand the reality but it seems rather simple I could be very ignorant I think Is all chemo very hard I know that part may be rough and Im not sure what shes going to go through but i want to support her with that I have a job interview tomorrow and am wondering if i should turn it down as I have 250 hours of PTO at my current job and think i may need the flexibility,2,1,8,2,1,8,0,0,0,0
203,Small cell lung cancer with with spots on the brain My mother in law has just had her diagnosis We dont know if the spots on her brain are cancer until after her 6 weeks of chemo before her radiation begins We dont know what stage All we know is there are two masses on her upper lungs with one big one pushing on her heart valve We are absolutely devastated Everything i have researched online has been confusing and id rather hear it from real people I know you cant give me an exact timeline or tell me what will happen from here Just looking to see if theres much hope from this limited information Please give it to me straight Thank you,2,1,7,2,1,8,0,0,1,0
204,22F removed spindle cell uterine sarcoma two years ago it's back Two years ago I had a 10cm sarcoma removed via myomectomy It was too infarcted to do a proper biopsy according to the surgeon They couldn't say if it was cancerous or not Nothing for almost two years but a routine ultrasound in December confirmed that I have another growth in my uterus It's 4cm this time I did another scan this Tuesday and found out that it's grown a whole centimetre in a month My doctor referred me to the oncology department at the hospital but nobody is giving me any answers They keep saying that there's no way to know if it's benign or malignant right now The oncologist's plan of treatment is watchful waiting what the fuck The only thing they've recommended is to stop my BC pills They don't know what it is so they'll just leave it I don't understand what they mean by no way to know does this mean I will only get an answer when I'm close to dead Anyway hi I don't know what to do or what the fuck is inside me,1,1,2,1,1,2,0,0,0,1
205,Brother having surgery today My brother is having surgery in Louisiana today to remove four tumors from his liver He was diagnosed with stage four neuroendocrine cancer several years ago The doctor told him that if they can keep the tumors in his liver user control then they can significantly extend his life I dont know a lot of details I live in AZ and cant be there for the surgery because I cant get the time off from work My question is does anyone have experience with having tumors removed from the liver I am wondering about his recovery time and how successful this kind of procedure usually is,2,2,7,2,2,5,0,0,1,0
206,Possible cancer recurrence Very worried any feedback is highly appreciated This is mostly to prepare myself for the worst yet hoping for the best I am so scared!TL DR After 4 years being testicular cancer free my lactate dehydrogenase (ldh) is elevated at 217 should I be worried 4 years ago I was diagnosed with a rare type of testicular cancer that was actually not located in the testicles but in my stomach The cancer had spread to my liver lungs and pancreas and I was very sick Luckily I pulled through and in fact so successfully that an operation was not needed Since then all checks have been fine with scans and blood tests giving great results However just today I was at my 4 year check the doctor told me that everything was good except my lactate dehydrogenase (ldh) level at 217 which was slightly over the limit She told me not to worry too much as it could be a result of other things such as fitness While I was in fact out and about the days leading up to I would not consider it strenuous exercise by any means! And that ldh in itself (with the,1,2,7,1,2,2,0,0,1,0
207,Long term effects M22 Just diagnosed with Ewing Sarcoma in the right side of my pelvis Lucky for me it hasn't metastasized and appears to be a very early stage My doctors are very confident that they can cure me but I'm worried about the long term effects of chemo and everything on my body When I beat this how much longer do I have It's an important question because one option when I'm done is to just go back to school like nothing happened But what I fear is spending so time to do anything else with my life,1,2,2,1,2,2,0,0,0,1
208,Mom has decided against chemo Mom has cancer in her liver and the doctors were convinced it had metastasized from somewhere else (they never could find it elsewhere) However yesterday she decided against started chemo next week as the 2nd MRI showed the cancer in the liver is too far gone to bother trying Her thinking is it would be better to have a few relatively comfortable months than drag out the months with the side effects of chemo Just a shot in the dark has anyone come across any new trials or treatments for this I'm just having a hard time coming to grips with this No one wants to lose their mom especially me Thanks in advance,2,1,7,2,1,8,0,0,1,0
209,This may be the steroids talking but Grawaaaaaaaa ahhhha I HATE cancer!!! Rwarrrrr!!!!!,1,0,0,1,0,0,0,0,0,0
210,Reoccurring cancer Last year my wife was diagnosed with cervical cancer due to HPV She went through with a hysterectomy and everything healed up just fine Just recently she came back with an abnormal pap Now there is cancer in her canal She has to go back for laser removal in the near future Every time we feel we are in the clear something else happens Its incredibly frustrating We dont know what to do except to keep fighting it Just feeling lost and needed to vent somewhere,2,1,7,2,1,7,0,0,0,0
211,Mother is inoperable assisted suicide this week need advice She is 61 I am 37 for some facts Father is out of the picture I am not an especially emotional person or close to my family My wifes family on the other hand is very close knit and I am close to them Not sure really what to post I am not really close to her but then she is my mother She had surgery to remove and attach the section of stomach that was having the issue they discovered it was in her small intestine not found on the scans I'm a bit torn She is very dramatic in life and selfish Now this isn't a i hate my mom post I'm merely rambling I am currently correcting things in my adult life that should have been addressed in my youth such as issues with my eyes I've had surgery to correct and other medical problems I am not concerned with holding these things against her I have not told her I am addressing them My reasoning for becoming distant from her was she would not bother to drive up to see her grand kids even though she lived,2,1,4,2,1,4,0,0,0,1
212,Mom now has stage 4 cancer Doctors just told my mom that she has stage 4 cancer she had stage 3 when she was diagnosed in the middle of 2017 I dont know what to do My hopes were high with stage 3 but with stage four i feel like i just got sucker punched and i cant get up Why Why she doesnt deserve this i dont even know what to do but stay strong and digest this for the sake of my mom,2,1,7,2,1,8,0,0,1,0
213,2nd opinion process So family member was diagnosed but I'd like to get a 2nd opinion I have no real issues with what the docs are doing but since they are recommending a major surgery I'd like a 2nd opinion Just wondering what the process is I guess docs will contact facility of my choice send test results then send the patient From there we speak to new facility and let them do whatever exams they want Some concerns Will insurance pay if they do tests over again How troublesome is moving the patient Can we come back to original facility if new facility recommends the same things How much control do we have over picking surgeons Thx all,2,0,0,2,0,0,0,0,0,0
214,My cancer free albino girlfriend and all her goofs and gaffs (pointless but positive survival story) My girlfriend's hair wasn't growing back after chemotherapy She's been extremely shy about it wearing a wig even during sex She doesn't talk about it with anyone I think it's because of the big deal everyone always made of her hair She was blessed with soft but silky wavy bright blonde hair right down to her waist Her hair is what made her unique what the people in her life admired She gritted her teeth through the chemo even though she's terrified of even getting her blood taken she kept it cool through the hair shedding in the shower turning up all over her clothes in clumps in her brush strands flooding her pillowcase When she lost the energy to do all the things she loves she was hopeful she still had time When the steroids made her bloated gave her acne made her rage and cry she only sometimes fell into despair More than a year without treatment and there was no sign of hair Her brows and lashes were sparse And she took it harder than anything else We went to a,2,1,2,2,1,2,0,0,0,0
215,Best ways to support a friend with breast cancer Dear fighters and caregivers One of my best friends (F 32) has been diagnosed with a hereditary form of breast cancer that has spread to her lymph nodes In the upcoming six months she will have to undergo 1) weekly (!) chemo with an experimental drug as part of a study2) a double mastectomy and removal of her ovaries3) radiation therapyIt's gonna be a rocky road ahead even though she has a wonderful support system and great healthcare I want to support her in any way I can If you've been the fighter what were the things your loved ones did that helped you the most If you've been a loved one what have you done that seemed to lend great support,2,1,2,2,1,2,0,0,0,1
216,The time finally came Hi all After a lengthy battle with ovarian cancer my moms time to leave came I'm so heartbroken and at a complete loss I've been up for about 28 hours and can't get to sleep She was my hero my best friend and an all around amazing person I don't know what I'm supposed to do now but I just know that I really love my Mom This sucks,2,1,7,2,1,8,0,0,1,0
217,Experiencing an emotional rollercoaster My grandmother was diagnosed with cancer several months ago It was in a relatively early stage and everything seemed to not be too bad with a good chance of survival She had surgery and was getting better Today I got the news that the cancer has spread which came unexpected for me First shocking news then somewhat good news then a hard battle then shocking news again Maybe I was just naive and in denial back when she was first diagnosed and I shouldn't have been so optimistic The harsh reality now is that she will probably die from cancer I just needed to vent a little because I feel sad and there's no one I can really talk to about it (it's hard for me to talk about my feelings in person) My dad is a mess right now and I'm not sure how to deal with it I'm terrible at comforting people emotionally,2,1,8,2,1,9,0,0,1,0
218,New Clinical Trial Search Engine from Cure Hub org Hello r Cancer community I would like to share something we've been working on and to get everyone's feedback It's a new easier way to find and enroll in cancer clinical trials You can find it @ called the Clinical Trial Finder and it works by taking all of the trials on ClinicalTrials gov and filtering them down to trials that meet 2 criteria 1) Cancer trials of treatments that have curative intent 2) Actively enrolling It then simplifies the search criteria so normal people can actually find what they are looking for If you're logged in you can flag trials to save for later leave comments on trials and see what trials other users have saved We are testing phase right now so any comments or suggestions that you may have would be helpful You can email the cure hub org team at help (at) cure hub (dot) org Thanks for your help The Cure Hub org team,0,0,0,0,0,0,0,0,0,0
219,Doctor told my mom there is nothing else they can do My mom has been receiving weekly chemos for stage 4 breast cancer for about a year Two different treatements were implemeted but neither has stopped the cancer from spreading Today the doctor told us there is nothing else they can do I really appreciate any advice on where to go from here especially info regarding clinical trials We are in SoCal but definitelly willing to relocate Thank you,2,1,7,2,1,8,0,0,1,0
220,What to include in a chemo care package Hi everyone I hope its ok that Im posting this here My best friend is about to go through chemo and radiation for Lymphoma and I would love to get some recommendations of things to include in a care package before she starts next week We currently live on opposite coasts so I was hoping to fit everything into a large USPS flat rate box So far Ive got her favorite candies ginger tea some essential oils a few funny books lip balm hand lotion and some socks that I knit Are there certain things someone will without a doubt need Is there something in particular that you may have found helpful to have on hand while you were going through treatment I would really appreciate any and all suggestions since I wont be there to help with meals transport to appointments and day to day help I would love to do whatever I can to help make her life a little easier ),2,1,7,2,1,0,0,0,1,0
