,Text,ZPatient,ZGender,ZAge,NPatient,NGender,NAge,DisagrPat,DisagrGen,DisagrAge,AgeExpl
0,I hope everyone has a happy and healthy 2018 There are new breakthroughs everyday for the fight against cancer May this be the year the big break comes to all of us fighting for our lives,0,0,0,0,0,0,0,0,0,0
1,Happy New year! I just wanted to wish everyone a happy New year I hope it works out for us all there may be challenges to come for some but I know we can get through it,0,0,0,0,0,0,0,0,0,0
2,Sleep problems Recently Ive had problems with sleep Some real problems Ive had times when I couldnt sleep it would take me a long time to fall asleep and when I do I sleep way too much Ive had times where Ive been awake for over 24 hours and cant sleep on the other hand when I do sleep I sleep for 14 20 hours Even if I havent been awake for a really long time Ill sleep far too much Also during those times I will wake myself up by hitting myself in the head On the side of my craniotomy I had in 2016 Sometimes rubbing hard or scratching but doing something while sleeping Im stage 4 melanoma I had a neck dissection in 2015 to remove tumor in my neck in 2016 craniotomy to remove 4cm tumor in left frontal lobe over Brocas area In 2015 I was on ipilumumab and keytruda after craniotomy Radiation treatments for both of course Im wondering what could be causing this Im going to ask my oncologist of course Im just wondering if anybody has had this happen Its very strange to wake up sitting up and hitting yourself,1,0,0,1,0,0,0,0,0,0
3,Will I be okay to resume my studies work with a month of recovery I'm really not sure on what to do My doctors gave me a clearance but I dont even know if I would be able to be up and drag myself to school I feel like I became a very weak person What would you do in my situation Its just the pressure to come back to school and finish my studies ASAP is bothering me (Stage 3 Nasopharyngal CA 6 rounds Cisplatin 35 Rads),1,0,3,1,0,3,0,0,0,0
4,Thanks yall Ive been lurking for a couple months since we found out my fathers pancreatic cancer has returned and metastasized to his lungs The hope and advice I see here is inspiring and has been so helpful to me in my darkest moments Tomorrow he starts chemo but we know its not for a cure just with the hope of simply shrinking the new tumors and improving his quality of life He was first diagnosed in 2015 and after a whipple chemo and radiation he was declared cancer free With this return were coming to terms with the fact that this is most likely his last year and its been really hard But we had a great Christmas with friends and family and now the fight begins again So thanks r cancer again for helping in some of my saddest most scared moments and for helping me realize my family is not alone Im learning that its okay to be vulnerable and admit this all sucks and that sometimes tears are absolutely warranted Good luck to everyone diagnosed with touched by and fighting cancer this year I wish you all the best,2,2,7,2,2,8,0,0,1,0
5,Throat Cancer and sense of smell heightened need advice My father is entering week 5 of treatments and taste saliva almost gone as expected He is complaining that his sense of smell is so heightened that it is really bothering him and even making him sick Anyone know any potential remedies to help with this,2,2,7,2,2,8,0,0,1,0
6,How do I help my mom with chemo My mom was diagnosed with Triple Negative stage 2 breast cancer She lives alone in Seattle works and I am visiting this week from NJ She will be doing her first chemo treatment tomorrow and she is absolutely petrified What can I do to make it a little bit comfortable for her What should I expect after tomorrow Thank you so much for your advice,2,1,7,2,1,8,0,0,1,0
7,Question about throats cancer and thick saliva My mother and I are trying to figure out things that may clear out his throats a little It's gotten so thick that he is sometimes throwing up from gagging on it Any home remedies out there,2,2,7,2,2,0,0,0,1,0
8,Salivary Gland Cancer Questions and Concerns Hi All I wanted to ask a few questions to anyone with knowledge experience with Salivary Gland Cancer In early November I noticed a lump on my jaw on the left side (about mid way down) and my doctor requested a CT Scan of the Neck The Attached ( are the results As you can see everything looks pretty normal but it states chronic tonsillitis and that theres mild hypertrophic of the Palestine tonsils Since that scan in early November (and after seeing the ENT) he said it was nothing but it feels as if both of my Submandibular glands have gotten bigger and even though it was just the left side originally now the right side is swollen too Both areas are tender and moveable but definitely swollen Im not sure whats going on but Ive been feeling fatigued for the past two months and something feels off Im 28 years old (zero medical issues) so Im not sure what it could be Im seeing another ENT next week but Im wondering what my next course of action is Should I ask for a biopsy Would the CT Scan have shown if there,1,0,2,1,0,2,0,0,0,1
9,Recovery from lobectomy Hi all I had stage 1B lung cancer treatment was lobectomy of my left upper lobe I have had an extremely slow recovery from surgery I'm still having a significant amount of pain and I'm not able to do much physically after 6 months I talked to my surgeon and his assistant many times Their answer was to give me pain meds and eventually ignore me I went to my PCP and told her my concerns and she gave me more pain meds but she also referred me to physical therapy It has been a mixed blessing I do think it's helping However it is extremely painful They give me some exercises to do but mainly I get deep tissue massage they tell me I have scar tissue and that my muscles have basically atrophied so it will take lots of work to get me back to where I was I also have a significant amount of nerve damage I know from prior surgery that it can take years for nerve pain to abate I am venting mostly but does anyone else have experience with this I'm wondering if I will need to go on pain management,1,0,7,1,0,7,0,0,0,0
10,What should I expect from pet ct scan and surgery Hi I was diagnosed with stage 2 tongue cancer Moderately differentiated Not extensive The pet scan showed Lymph nodes There is a mildly prominent right level 2 lymph node measuring 1 3 cm x 1 9 cm This node is mildly hypermetabolic (maximal SUV 4 4 image 65) For comparison a smaller size left level 2 node in the jugulodigastric region measures maximal SUV 4 2 image 61 No pathologic adenopathy by imaging size criteria However on PET there is additionally a moderately active small right level 3 cervical lymph node anterior to the common carotid artery image 76 SUV 4 5 0 7 x 0 6 cm I had my surgery this Friday Dr took out 2 lymph nodes and said he couldn't see any traces of tumor but they will be sent to pathology What do you think the pathology reports will show What is the most likely scenario for me Also dr said my tumor was about 3 5 cm but pet ct showed that it was 2 5cm Does that mean the dr couldn't actually see the extent of the tumor,1,0,0,1,0,0,0,0,0,0
11,Cure to Cancer Meaning Hey guys There's this question that I've always wanted an answer to yet never really asked When people say a cure to cancer often is this even possible (in technical aspects I'll explain) I know cancer could affect all kinds of areas from the brain lung neck head etc So does the statement a cure to cancer make sense or can a cure only be found for one area and then another cure must be found for another area In other words if you could also explain are the mechanisms of what proliferates cancer common to all body parts making a cure for one part essentially a cure for another or does cancer work significantly different for different body parts Thanks,0,0,0,0,0,0,0,0,0,0
12,Is it fatigue or just me being the lazy piece of shit I've always been So I've always been a big procrastinator (in the style of due tomorrow do tomorrow ) but lately I've caught myself doing even less than usual with the excuse (mainly to myself) it's the fatigue nothing to be done So my question Is there a way to differenciate between me just being lazy as usual and cancer really taking a poll on me Because I understand that fatigue is really a thing but I still want to get shit done and pass my classes,1,0,3,1,0,3,0,0,0,0
13,It feels like there's a new issue every month I was diagnosed with leukemia when I was 17 (in 2014 ) First were the normal low immune system stuff I got a yeast infection in my throat After a few weeks though I got steroid induced diabetes That was probably the worst of it Diabetes was a constant thing I had to worry about It went away after a few months I dont think I had many other problems until the second year of chemo I got 2 warts on my feet; 1 on each foot They were huge and hurt a ton and I was at my first semester of a college with a huge campus I didnt attend that college for a second semester and in February of 2016 I got the warts cut out and had a skin graft to cover the hole There was a chance that the warts would come back but they came back UNDER the skin graft It was painful and disgusting Warts quickly took over the bottom of my feet and they were super painful Freezing them didnt work so we tried lasers The lasers worked! They were slowly going away I,1,0,2,1,0,2,0,0,0,1
14,Votrient side effects My brother has been battling DSRCT for 18 months and we just experienced a huge blow in the form of side effects from the votrient We thought he had developed pneumonia and he was hospitalized last week His lung capacity is severely diminished and he struggles to breath even on oxygen All tests came back negative for fungal bacterial viral and even cancer progression The doctors feel it is an uncommon side effect from the chemotherapy Does anyone have any first hand experience with this Will his lungs heal Is it temporary They're trying steroids now but it has not helped His only chance to prolong his life is through surgery and he can not do it in his current condition I'm getting desperate for anything information wise I don't want this to end like this,2,2,3,2,2,3,0,0,0,0
15,Night sweats after chemo SCT Has anyone had night sweats after chemo is completely finished I had an auto SCT for DLBCL in October and my body seems to be having a hard time adjusting to temperature still A little breeze will give me chills for instance I've had night sweats a few times since then too and I'm wondering if this is just something that happens sometimes Has anyone else had these lingering effects after treatment ended I never had night sweats before diagnosis My 3 month scans are at the end of January so I guess we'll see then if there's anything else going on,1,0,0,1,0,0,0,0,0,0
16,21f likely Hodgkins Lymphoma recurrence i dont know where else to post thisMy friends and family understand but they dont UNDERSTANDIm 21 and a little over a year ago was my last treatment for stage 4 hodgkinsim showing signs of recurrance my doctors and family are worried i took a blood test today and theyre going to call me to schedule my PETi had to use my inhaler for the first time in a year last night after just going to the grocery store and today i nearly collapsed making dinnerim 21 single live alone with my cats and tried to commit suicide 6 months ago and now my cancer is probably backi justim on the verge of a meltdown,1,0,2,1,0,2,0,0,0,1
17,POEMS Syndrome My father was recently diagnosed with POEMS syndrome I don't know much about it I Was wondering if anyone on here had any experience with it or knows anything about it Thanks,2,2,7,2,2,8,0,0,1,0
18,Biopsy after finishing chemo Hi r cancerI just had my post chemo scans and was told that mostly everything looks better but there is an ambiguous mildly hypermetabolic area that showed up on the PET scan that my oncologist is not sure if it's remaining cancer or an infection or inflammation I'm a little shocked because while I knew this was a possibility after surgery radiation and chemotherapy I thought I would be fine My oncologist is known to be extremely cautious about everything and she was telling me that there's a possibility that I'd have to have another biopsy of the suspicious area Has this happened to anyone else before If it was malignant would I have to do even more chemo This seems crazy to me I mean I know I didn't have the best luck with getting cancer in general but after having gone through nearly 9 months of treatment I thought I'd paid my dues Maybe I'm overreacting I guess I'm just overwhelmed,1,0,7,1,0,0,0,0,1,0
19,How long does it take for swollen lymph nodes to go away during chemo Stage 2 HL starting chemo soon I can't recognize my own face when I look in the mirror because of how swollen they are and its definetly ruining my confidence How long till I start to look like myself again,1,0,0,1,0,0,0,0,0,0
20,Annoyed vent my lung lobe is collapsed and I can't seem to get an appointment with pulmonology My oncologist referred me to interventional pulmonology because there is a tumor blocking the middle right lung lobe and the lobe has completely collapsed This was Dec 20th I've been on the phone a half dozen different times with the specialty clinic and they can't seem to figure out who I'm supposed to see and when They gave me an appointment with the nurse practioner which is not going to get me any closer to evaluating whether I'm a candidate for some kind of intervention to remove tumor bulk and get my lung lobe re inflated So I am shuffling about having a lot of trouble breathing and I'm massively annoyed Hopefully they will call me tomorrow and let me know what the deal is,1,0,7,1,0,0,0,0,1,0
21,Will my chemo affect any future children in any way I went through testicular cancer early this year and after removal and chemo to treat I am cancer free I had banked sperm just incase but since finishing my treatment i have been tested and am still fertile (very low in mobility and count)My partner is understandably of thrilled with the idea of IVF and my question is if we where to consive naturally now as apposed to doing IVF with my pre chemo banked sperm would it affect how our child may turn out I e is there a greater chance of something being wrong with the child one way or another,1,2,5,1,2,5,0,0,0,0
22,Imunotherapies for Melanoma Can anyone give me a no nonsense breakdown of the different treatments and their effectiveness Stage 3 and 4 Melanoma survival rates seem pretty dim but apparently these statistics are relatively out dated Any help those experiencing this can give me would be greatly appreciated Thanks,0,0,0,0,0,0,0,0,0,0
23,Scanxiety about Tomorrow My first official post treatment checkup is tomorrow I've done 14 rounds of chemo 20 radiation and 3 major surgeries (2 resection and 1 complication unrelated to cancer) since January of last year I'm nervous I got through all of the challenges I've faced so far Probably the worst of it was side effects of the radiation I dealt with severe ascites and put on 20 lbs of water weight and ended up losing 35 lbs since Thanksgiving (including that 20 lbs of water weight) My cancer is aggressive I'm just hoping and praying the treatment did it's job in killing the cancer cells and I can go another 3 months not having to worry about possible treatment or anything else Also if everything is clear I can get back to work and begin focusing on other things beyond cancer Wishing you all good health this 2018 Be strong stay positive and enjoy every moment we (collectively) have together,1,0,7,1,0,5,0,0,1,0
24,I'm so lost and frustrated about my dad's cancer My father is in week 5 of throats cancer treatment and it seems like only the last few days he has dramatically gone downhill in terms of his condition The thing is his cancer is quickly being destroyed and the doctors have been encouraged about his progress The radiation and chemo have taken a heavy toll He refuses to eat and today he doesn't want to get up He just lays there staring off or sleeping The thick mucous builds and he has to get up constantly to throw up which agitates him even more Where I am pissed is that during his radiation today he told the doctor he wanted to be admitted but they told him they cannot because they cannot find anything to admit him for His vitals were good and they believe he is his own worst enemy now I feel like when I wake up in the morning he won't be alive as he is just completely sapped of energy and any will to move forward My mom is very upset and feels even more helpless than I do I wish there was something I could,2,2,8,2,2,8,0,0,0,0
25,Experience with follow up care in the EU Hello all We've finished the intensive treatment for leukemia (B ALL) of my son and now we're starting to look into post treatment steps (though he still has ~1 5 years of non intensive treatment it's good to be prepared) I found a couple of resources specific to the US ( etc) but nothing really in the EU (which makes sense since I'm searching in English) Does anyone here have experience with follow up care in the EU (Germany France Italy the Netherlands etc) At this stage I'm wondering are there dedicated (medical) organizations in these countries for cancer survivors is there a doctor team of doctors who follows the patient over the years and makes sure to get the tests done or is that more the responsibility of the parent Thank you and have a good day!,2,2,3,2,2,1,0,0,1,0
26,Is massage ok My dad is currently undergoing chemo to treat bowel cancer He mentioned yesterday that his shoulders were really tense I was wandering if I could arrange a massage for him but I have a vague memory of someone telling me previously that massage is not a good idea because of lymph node stimulation Could someone offer any advice on this,2,2,7,2,2,8,0,0,1,0
27,I'm a mess On November 27th at 7 in the morning my sister passed I'm still in shock and disbelief from it but slowly getting there It was so fast We had seen her on wednesday she was happy talking and in a good mood Friday night she had a massive headache was throwing up and not doing well Saturday morning 911 was called and she became non responsive Saturday night they moved her to palliative care Monday morning she passed We're all still dealing with it and I'm just so glad I cancelled my meeting on that wednesday to go see her If I hadn't I would have never been able to talk to her or tell her I love her one last time I just needed to vent and thank everyone here for the help they gave in the past,2,1,7,2,1,0,0,0,1,0
28,Looking for some direction with treatment Hi I am looking for a some advice My sister is struggling with breast cancer They caught it pretty early and told her she would do well but she stopped responding to the chemo after 12 weeks so now they are telling her they won't do surgery and best option is to try another chemo It's pretty heartbreaking cause they say she has 6 to 12 months and this could be 20% chance of helping It has not metastasized I am wondering if would be better idea to try to get in at one of the bigger cancer centers maybe some kind of trial or would they be doing same kind of thing trying a different type of chemo I think it's crazy her doctors didnt have a plan ready for this and that we are scrambling to figure out what to do now since they want to start chemo again in a day or two which could make things even worse if it doesnt work,2,1,7,2,1,0,0,0,1,0
29,Afatinib Chemotherapy So my mom was diagnosed with stage 4 lung cancer about a week before Christmas Its a mutation that can thankfully be attacked with a pill Its called afatinib or Gilotrif Is anyone familiar with this drug and what it does to the person taking it Thanks a bunch,2,1,7,2,1,8,0,0,1,0
30,Parent survival should I feel anything So this is the backstory My mum was diagnosed with something on her Kidney I say something because the doctors just didn't know what it was but It was causing her a lot of pain She ended up having surgery about 2 weeks later at a private hospital She had one kidney removed along with her adrenal gland They didn't actually confirm it was cancer until about a week after so yeah She has been in recovery since and is still not at work I have no doubt that she won't be back and up on her feet in a couple of months She has another check up soon I should be happy right I don't feel it and that's not to say that I feel sad because I don't feel sad either I felt worried before her surgery but I wasn't like super worried because we just didn't know what it was My nan is really upset over the whole situation I just don't feel anything really everything to me is just normal of which I just don't understand Surely I should be feeling something everyone else is I don't know why I'm,2,1,7,2,1,8,0,0,1,0
31,Suspected stage 3 turns out to be stage 1! Hello I just wanted to share my experience with tongue cancer as a 22 year old I had a lesion on my tongue for months and since it didn't cause me any much pain I ignored it Then I decided to go to a doctor The first doctor told me it was thrush (yeast infection) and gave me medication for 10 days After day 5 I started to become suspicious and went to a dentist Dentist told me that he was 99 9% sure that it was lichenoid mucusitis which is basically dermatitis on the tongue However he told me to get a biopsy just to be sure Then I went to an oral surgeon This was the worst The oral surgeon discussed what it could be for like 20 minutes and he basically told me that it looked aggressive After that appointment I cried outside on the pavement Thankfully I work in a cancer research lab so I called my lab manager and they scheduled an appointment with an amazing oncologist The next day I went in for a biopsy with my new oncologist 4 days later my doctor called,1,0,5,1,0,2,0,0,1,1
32,US In 2015 wife (36) was diagnosed with cancer while pregnant 2 years later (2017) they found a tiny mass that is the same cancer as before They want to put her on Lupron Arimidex Seeking Treatment Advice October 2015 = Wife is pregnant and diagnosed with Stage 3 triple positive cancer in left breast She delivers baby early on chemo for 1 year and has surgery removing 13 lymph nodes on the left side Port is removed December 2016 and everything seems good She is put on Tamoxifen for 5 years October 2017 = Oncologist finds a supra clavical lump in the fatty tissue near artery nerves on left side of neck shoulder area Surgery to remove it for biopsy comes back as positive for the same exact cancer as before They want to give her 28 doses of radiation for that area (not previously treated) and trigger menopause via Lupron and then put her on a pill called Arimidex They are concerned as the cancer clearly grew while she is taking tamoxifen Wife's OBGYN is not happy with the Lupron Arimidex treatment and says she should not be on that for more than 9 months Oncologist wants her,2,1,4,2,1,2,0,0,1,1
33,Mom has stage IV pancreatic cancer may have 8 weeks when do I go home Ive been reading through all of the terminal family member posts and feel the need to write something myself This is a great community and thank you everyone for sharing your thoughts experiences questions etc It's remarkable The PanCan network was helpful for me when my mom was diagnosed but that was 2 5 years ago She's held on for a long time at stage IV! I've been in several family member support groups for pancreatic cancer but all of the patients of my fellow support group members died a long time ago and it was really depressing to be constantly reminded that she was going to die eventually and pancreatic cancer is so awful Anyways 2 5 years later she's still with us but the cancer has started to spread to her spine and further into her lungs making it difficult for her to breathe She entered home hospice care today and the nurses said she might have 6 8 weeks I have a family of my own so it'll be tough to leave them but I want to spend as much time with,2,1,8,2,1,8,0,0,0,0
34,Boss's wife recently diagnosed with Cancer and was wondering what other than flowers to send So my boss's wife was recently diagnosed with gallbladder ovarian and uterine cancer I was trying to think of something to get her that would maybe be useful or more thoughtful than just flowers They already have housekeepers meals etc handled for them on a regular basis (they're the business owners) Any ideas are appreciated TIA!,2,1,7,2,1,7,0,0,0,0
35,False positive PET scan six months after treatment My wife had her six month scan after DA EPOCH R treatment for DLBCL last ending in May She had one small spot on her mesentary lymph node in the post treatment and three month scan that has gone completely now However a new spot (1 3cm x 0 3cm) has shown up in the lymph node under her left arm pit The hosipital screwed up and released the scan report to us before we saw our oncologist Cue two days of worry for us Today we saw our oncologist and he explained he feels its most likely a false positive as the shape is wrong and it only just showed up after nothing there before during or after treatment Has anybody else experienced false positives I guess this is another fun aspect of scanxiety,2,1,7,2,1,7,0,0,0,0
36,I feel like I watched someone else die My spouse recently passed and because the cancer took so long and it took so much from him it feels like I watched someone else die Its like hes been gone for a long time on vacation It makes all this feel even less real The cancer took him away long before he died and slowly Has anyone else had a similar experience,2,2,7,2,2,7,0,0,0,0
