,Text,ZPatient,ZGender,ZAge,NPatient,NGender,NAge,DisagrPat,DisagrGen,DisagrAge,AgeExpl
499,Mom diagnosed with Stage 4 NSC Lung Cancer opting for clinical trial of Durvalumab Tremelimumab vaccine Anyone else have experience with these immunotherapy drugs I see that the two drugs (not the vaccine) were recently FDA approved for Stage 3 NSCLC Anyone else in the same clinical trial They are currently enrolling from what I can see She had the option of chemo keytruda but we sort of agreed that the clinical trial might be a better option Really hoping for the best a lot of immunotherapy articles and videos make it sound like its a great option,2,1,7,2,1,8,0,0,1,0
500,Hi my cousin found that he has stage 4 cancer I dont know exact details because he is far way in another country and we are searching for what treatment to do which is best treatment I know his liver is heavily effected and lungs to and they found it in brain also,2,2,0,2,2,0,0,0,0,0
501,Does anyone know about cervial cancer in situ reoccurance rates Would like to preface that I've already seen my doc and am waiting lab results and further testing However I just need someone to talk to in the meantime History (forgive me if my terminology is off I was only 16 and no one gave me much information) I had abnormal PAPs from 14 16 when they finally did a biopsy and found pre cancerous cells in my cervix I underwent a LEEP and my GYN said after that it was good that I did thus then as some of the deeper levels of cells were already turning I assume that this was cancer in situ That was 17 years ago I have had 3 kids since then and every PAP has come back normal I even insisted on getting one every year because I have a history 2 years ago I started having pain and bleeding with intercourse (a lot of blood more than just from some tears) and spotting between periods This is after an endometrial ablation in 2012 I also have all the risk factors for cervical cancer; a history of multiple partners a history of HPV,1,1,2,1,1,2,0,0,0,1
502,Can you live a normal life with Stage 4 Cancer Like i just looked up a girl she's 25 years got diagnosed with Colon cancer that metastized to the liver and Lungs How does it come that she lives such a good life and recently got married Can you live with cancer your whole life like a brake on the cancer,2,1,2,2,1,2,0,0,0,1
503,My MIL is 55 with pancreatic cancer and just got taken off chemo help From what I understand the chemo was killing her faster than the cancer and they decided she would be more comfortable potentially live a little longer without it We found this out last night I don't know where to start me and my fiance met in 2016 fell in love and 9 months later found out we were having a baby about a year later we now have the most amazing 11wk old little boy and we couldn't be more in love with him or each other August 2017 we visited her mom who lives 4 hours away in her hometown we visited to watch the total eclipse together everything was normal it was only a couple weeks after that she went to the hospital because she had yellow in her eyes and wasn't feeling very good Her name is C she is a therapist and a mother of 3 girls She has fought cancer 3 or 4 other times and lived through but this time is different They scrambled for weeks to figure out what was actually wrong removing ducts and small organs until they,2,1,4,2,1,4,0,0,0,1
504,Eating Hey all my mother in law has been diagnosed with stage 4 small cell 2 months ago She's been through radiation for a brain tumor linked to her original affliction and is halfway through her first chemo treatment I know doc's orders on food and protein but she's been eating shitly at best and I'm super concerned She's a very bright and intelligent lady and I can see she's not making smart choices but I also understand that I have zero experience with what she's going through I know she needs carbs and protein to power the body to heal but how do I make this happen TIA for your insight!,2,1,8,2,1,8,0,0,0,0
505,My dad is a few cigarettes a week smoker after nearly 40 years of smoking i finally got my dad to start vaping I know vaping is still probably pretty bad but at least it doesnt have all those chemicals from smoking cigarettes Now ive noticed he has started casually smoking again only a few a week at the most( i know this because his apartment building recently went cig free and will know if he is smoking) however its cold in minnesota and we live together and i can clearly see he isnt smoking even close to what he used to smoke Its a lot of work for him to go all the way outside to smoke in the cold he much prefers staying in and vaping However if he needs to drive somewhere or go some place he goes right back to smoking As a person who completely switched to vaping 5 or 6 years ago i just dont get why hes still attracted to smoking cigarettes its just silly in my eyes just flirting with death man I dont know how to convince him that any smoking is bad and he is really still at risk even,2,2,8,2,2,8,0,0,0,0
506,Skin Cancer Dermatologist Appointment Experience Info Needed UK! Hi everyone I just wanted to ask here for a bit more information on peoples experiences with appointments after receiving Skin Cancer diagnosis in the UK My mum went to her GP last year about some unusual marks primarily on her face which had been bleeding The doctor eventually told her that these areas were skin cancer and referred her for a dermatology appointment at the hospital This was in October So she got an appointment to see the dermatologist and this was cancelled via post She then waited for a new appointment which was scheduled for last week She turned up at the hospital for the appointment and was told that the dermatologist was ill and shed have to go home and then wait for another appointment letter We currently have no idea what type of skin cancer it is as this was supposed to be the appointment to try to establish that I think (Im sorry Im not entirely sure of the process) and were just sort of waiting in limbo since October to get this appointment I just wondered what other peoples experiences of this have been Is this,2,1,7,2,1,8,0,0,1,0
507,Mother has multiple cancers in her breast Hi everyone I posted about a month ago that my mom was going to get her mammogram done due to a lump in her breast Turns out after a biopsy we find out that it is in fact breast cancer (Invasive ductal carcinoma) Something that we were expecting considering that most of the doctors were telling us sorry and that it was a curable disease My mom went to the surgeon to talk about the removal of the lump being told that it was at least stage 2 and that a lumpectomy was the best route to go and that it was 'basal like' Surgery planned for March! My mom ahead of time looked up how to read the forms given to you and found something odd When asked the surgeon told us that it was a type of skin cancer From what I have read this isn't a good thing I'm not too sure what this means but was wondering if anyone else has went through this How did it turn out I'm very nervous about her options in the future and I know she is scared about all of this too,2,1,7,2,1,8,0,0,1,0
508,Hairloss Hey! I'm starting a new regimen of chemo Things are looking good health wise but I was wondering hair wise It's low dosage oral (100 mg a day at most) The two drugs that concern me are Etoposide and Cytoxan I'm not taking both at once I take the Etoposide for 3 weeks everyday then switch to the Cytoxan every day then 3 weeks later back to Etoposide and etc I heard they can cause hairloss but wasn't sure if that was infusion only or if low oral based doses could cause it too If you or anyone you know has any feedback please reply,1,0,0,1,0,0,0,0,0,0
509,Ultrasound Results Help explain them to me please I have noticed a hard lump on the back right side of my neck about 6 or 7 weeks ago and got an ultrasound on it last week I just got the results but really dont know what they mean If anyone could help explain them to me I would be very appreciative I will copy and paste them below STUDY SOFT TISSUE NECK ULTRASOUNDREASON FOR EXAM Male 21 years old Palpable lumpTECHNIQUE Ultrasound evaluation of the thyroid was performed with real timeand static gray scale imaging COMPARISON None FINDINGS Sonographic evaluation of the palpable lump in the posterior right side of theneck shows a well defined hypoechoic lymph node measuring 1 3 x 0 9 x 0 3 cm There is a fatty hilum and no suspicious hyperemia or echogenicity to suspectinflammation IMPRESSION Small subcutaneous lymph node Electronically Signed some doctors name,1,2,2,1,2,2,0,0,0,1
510,Eating after stomach surgery Im operating on a total laypersons understanding of this so please forgive me for my lack of details!My beloved uncle is having surgery to remove a tumor in his stomach in a few weeks We are staying very hopeful and positive about the outcome but obviously recovery is going to be rough on him To ease the stress on my aunt Ive been making soups ahead of time and freezing them Just curious if anyone here has undergone the surgery and would be okay sharing how it was eating during recovery Ive been making very smooth pureed stuff like split pea and butternut squash but I dont know what I should be keeping in mind I know hell get more specific directions from his doc but for now Im trying to front load as much as I can Thank you sincerely to anyone whos willing to share!,2,2,8,2,2,7,0,0,1,0
511,Mom given a BI RADS 4c today Freaking out Edit 2 hahahahah fuck our lives the report is in and it's actually BIRADS 5 My mom had a lump in her breast that she showed me back in December I'm an oncology nurse I had my suspicions and I told her to go get that checked out ASAP This was when she was visiting in the US and she said she would when she got back to our home country I'm visiting my parents now and she HADN'T gotten it checked out She said she didn't have money for it I literally dragged her out to get it looked at I knew as soon as I looked at the ultrasound but I had to play stupid because well it's not my job to give my impression of a medical image In Mexico the radiologist does the ultrasound and gives you his impression right away although he has not written the report yet He was giving her very vague information Finally I told him I was an onc nurse in the US (which I HATE having to say) He looked at me and explained his findings and told me it was,2,1,8,2,1,8,0,0,0,0
512,Yesterday my father died to stage 4 cancer Fuck cancer I have never had the best relationship with my father He's always been a quiet and reserved man You could tell he loved his kids though My father had several mental issues in the past so I can imagine that playing a role in his reservedness My mother and friends of her said he's had a rough life as well It's horrible to imagine that my dad is actually gone forever He never said a lot and avoided conversations in general but I understand considering his rough past My father has never been the 'typical dad' who asks you how you are and how your day has been and we barely bonded with each other That makes it hurt more but I don't blame him at all I'll miss watching over him with my family which we did for the last few weeks I'm happy we made sure to have footage of the last weeks though On the day my father died my brother and I were watching him in the afternoon and the early evening but we left a bit later because my mom was going to be watching,2,2,4,2,2,4,0,0,0,1
513,Blood sugar So with all the various medications I'm currently being mandated to take my blood sugar is constantly elevated to which I give credit to the Prednisone I have to take 200 300 range Now my oncology team says they don't care until it reaches the 700 range plus however I disagree with that I am taking Glyberide sp to keep it where it is I don't consume much sugar through my diet Whatever I get is from the Ensure I use to take all the pills My normal blood sugar is around 100 Has anyone here had blood sugar issues through medication post chemo transplant and if so how did you deal with it,1,0,7,1,0,0,0,0,1,0
514,Starting Chemo next week I'm starting chemo for the first time next week and the truth is that I'm extremely terrified It's a very strong chemo and I'm not sure what to expect Any tips on what helps endure the treatment and what I may expect,1,0,0,1,0,0,0,0,0,0
515,What to buy for terminal cancer Im half the world away and my dads fianc (long term partner) got told on Tuesday shes terminal What can I get them Hes distraught So am I,2,1,8,2,1,7,0,0,1,0
516,It is heartwrenching for me to announce that one of our own has passed Tonight I recieved the news that Ellie better known as EllieMay0305 a huge member of our community (whether it be on here or our discord) has passed away Rest easy love you are no longer in any more pain lt; 3Edit This is a song that Ellie made and recorded last year she was incredibly talented Give it a listen and let's blow up those views and likes in her honor,2,1,0,2,1,0,0,0,0,0
517,My dad starts chemo in a week Know any advice tips anything that may help He's starting BCG (Bacillus Calmette Guerin) therapy apparently a type of bacterial chemotherapy for bladder cancer That's all I know I'm going to be staying with him but I don't know how it's going to go or what to expect or in what way I can really help Anyone have any experience with chemotherapy in general or with BCG therapy Thanks in advance,2,2,7,2,2,8,0,0,1,0
518,How long did you stay on your chemo My mom has stage 4 pancreatic cancer (adenocarcinoma) She responded really well to FOLFIRINOX and the cancer has shrunk to barely there We've dropped the irinotecan now to help with side effects and still the cancer is stable She's been on this treatment since Oct 2015 She gets it every other week and right now the doctors want to do this indefinitely Anyone out there have other stories about stopping Or staying on it for years at a time,2,1,7,2,1,8,0,0,1,0
519,Mom started Carbo Taxol chemo yesterday and hasn't shown any symptoms yet Anyone else experience this My mom has stage 3 Squamous Cell Carcinoma in her esophagus Her treatment plan changed many times before her oncologist recommended Carbo Taxol once a week for 3 weeks with a 1 week break before she does a second cycle She didn't feel anything strange during the infusion yesterday and was incredibly full of energy afterwards Even today she's experienced no nausea fatigue etc Nothing At first I believed it was the steroids they gave her before the infusion began but we all expected the negative symptoms to begin by now Don't get me wrong I'm incredibly grateful for her health I'm just waiting for the other shoe to drop and wondering if anyone else out there has experienced this I'm still learning that this is the method of cancer every day there is a new rollercoaster to ride,2,1,7,2,1,8,0,0,1,0
520,Recently diagnosed with stage 3 colon cancer @ 22 Hi guys I usually hover around reddit and don't post much but I need a little advice A little backstory (slightly graphic) I was diagnosed with crohn's at the age of 7 and started having rectal bleeding problems around 19 I had a colonoscopy done around half a year ago and they found a litany of polyps covering my ascending colon area I had surgery to remove this portion of my colon a few months later and low and behold they found 4 52 lymph nodes within the surrounding fatty tissue to contain cancerous cells Luckily I have a wonderful surgeon that was able to remove so many nodes!So currently I'm wavering at stage 3 colon cancer and have begun FOLFOX a month ago (2 treatments in) Fortunately my MRI showed that there isn't any cancerous activity or tumors that have spread beyond my colon However I was diagnosed with PSC (liver bile duct disease) and that now has to be monitored My oncologist suggested I have my entire colon rectum removed I've always wanted to avoid this kind of surgery being that I'm young (and stubborn) and I think the,1,0,2,1,0,2,0,0,0,1
521,Should my Papa try medical marijuana My grandfather (age 80) was just diagnosed with stage IV pancreatic cancer He starts chemo tomorrow and he's already so weak with almost no appetite I'm desperate to find some way to help but my very conservative family will not consider medical marijuana (just legalized for cancer patients in our state) Has anyone (or anyone you know) had any experience with it and did it help you through treatment,2,2,9,2,2,9,0,0,0,1
522,My dad has cancer My dad has stage three lymphoma cancer and he has left he wife for another women Can you guys keep him in your prayers,2,2,7,2,2,7,0,0,0,0
523,My mom passed away Valentine's day I made a post about her having cancer a bit ago It was such a shock to hear she had cancer back on August 21st 2017 They said chemotherapy would probably work It made her fall constantly neuropathy is what they called it I think They did another med instead and it caused her to be sick constantly She decided she didn't want that one and they chose one more type to replace that one Unfortunately the lesions on her liver were expanding growing Fast forward to January 20th 2018 She asked me to bring her to the ER because she felt she was constipated They admitted her and tried a bunch of stuff They put an NG Tube in to relieve pressure The oncologist said that he didn't have anything else to help They gave her 1 6 months She hadn't really been eating that well They had her on IV fluids They we're going to put in a G tube or PEG tube They couldn't get the endoscope down to do it They had to transfer her They did Once there they put the PEG tube in and attempted feedings It caused,2,1,8,2,1,8,0,0,0,0
524,I don't know what's next Hey all So to cut to the chase mom has stage 3 uterine cancer and is currently in the hospital with lung complications I don't know what the next step is She's getting a drain in to help her lungs She cannot walk due to being in the hopspital the whole month of February (got out 2 14 but went back in days later and it's been a week today) She had an infection they got it Now they are looking in the lungs to see what's going on She obviously isn't walking needs full assistance with everyday needs such as bathing etc I pray to God there's nothing there I can't do this I can't watch my mother die I can't keep paying the bills every month freaking out wondering how much money will be left I have college one more year left on my B A I'm afraid to register for classes because what if she dies She talks so out of character for herself that she's a mess Hell I'm a mess My anxiety is killing me I cry almost all the time now and Im pretty much a sack of walking,2,1,8,2,1,8,0,0,0,0
525,Friend's mother's last week alive Any suggestions I have a friend whose mother's stomach cancer returned about 4 years after the original operation spreading to other internal organs She's probably having her last week barely lucid and dosed up on morphine trying to make it another 5 days to when her son returns from deployment so the family can be together when she goes I proposed to visit a few weeks ago but she didn't want to be seen in such a weak state I've been sending emails and photos to try to keep her entertained for the last few months (during chemo and also now that she's too weak to leave bed) but apparently since the weekend she's been too tired and mentally absent to read them any more I've had several recent telephone conversations with my friend (she lives on the other side of the country 2hrs from her mother) and she seems to have mentally prepared herself for the inevitable as any positive medical news failed to materialize over the past 6 months I'll be sending flowers when the news comes through of her death and trying to increase her father's involvement in eventual social interaction so,2,1,8,2,1,8,0,0,0,0
526,Stage IV metastatic non small lung cancer My dad is 65 and his understandable fear blocks his ability to absorb any information that is not good So I do it for him All we know is the PET scan showed the cancer is metastatic stage four involved other organs and bone He has a very specific and rare kidney disease (necrotizing glomuronephritis anca neg) which complicates things We are meeting with the oncologist this afternoon What questions would you ask as the patient I asked over at r askdocs and got a great response but as the patient what would you want to know,2,2,9,2,2,9,0,0,0,1
527,Anyone know about internal radiation Brachytherapy for uterus cancer Is it painful What are the side effects I keep getting different info but I trust you guys more than opinions of people who haven't really gone through it Please let me know Thank you,0,0,0,1,1,0,1,1,0,0
528,Father was diagnosed 2 weeks ago Help About 2 weeks ago around Valentines Day my father was diagnosed with stage IV pancreatic cancer At that point it had spread to his stomach and liver and he was given 4 6 months depending on chemo A few days later he was in the hospital again due to pain and they found tumors surrounding his intestines which made his body too week for chemo He was at that make him comfortable stage Im not sure how to process this Ive thought about seeking therapy seeing as Ive dealt with depressive tendencies but short of that Im not sure what feelings are valid How have some of you gotten through this,2,2,7,2,2,8,0,0,1,0
529,Stage IV prostate cancer with metastasis Please suggest questions My dad (71 in May) was diagnosed with stage IV prostate cancer which has already spread to 7 bones TURP and Orchidectomy was done on 19th February PSA was 388 and Gleason Score was 5 3=8 before surgery We were told that no major surgery was optimal and medication will be suggested only after further PSA tests and about 3 years is the time he has left We will meet the Urology department in two days again Please suggest me some of the most important questions I need to ask them (Dad doesn't know it is serious) Thank you edit month,2,2,9,2,2,9,0,0,0,1
530,Tomorrow I'm going to see if I have throat cancer I don't know if this is the right subreddit but if someone knows I need answer I feel something in my throat 6 months now I have visited doctor he looked at my throat with that mini camera and he said that I'm clean Although he did gave me some pills called Nexius so we can try a therapy for that thing that I'm feeling in my throat My question is if I really do have cancer shouldn't be appear through the camera that doctor looked I mean my throat should look like hell right And yes I was smoking I'm in a lot of stress and I can't handle it I'm only 20 years old and I'm worried more about my family than me I really don't care about me I'm just worried about them You see me writing all these because I'm really in stress,1,0,2,1,0,2,0,0,0,1
531,Caregiver frustrated Any ideas on how I can ease her into eating small meals frequently My mom has been fighting stage four stomach and lung cancer since her diagnosis last October One round of chemo was ok for her to bear but she has lost over 40 lbs Currently at 90lbs and 5'9 We are expecting to through another round since her tumors have caused significant plueral effusion causing shortness of breath This in turn causes her to not want to eat since she feels anything will choke her up and cough Surgery another round of chemo or treatment is not advised until she gets her weight up We have tried soups small bites and the food just sits there for hours She obviously refuses a feeding tube She strong in her faith and says the Lord will take care of her Any ideas on how I can ease her into eating small meals frequently,2,1,8,2,1,8,0,0,0,0
532,Is it wrong to tell my mum ( cancer patient) peoples stories i see on here I was doing this when my aunt says stop telling her these things they're negative and will get her down I think the opposite I feel like these stories people share about cancer experiences would make her feel like she isn't alone that she can fight it and after all if we as a community don't share these stories who will of everyone thinks it's negative Am I mistaken or Thanks,2,1,7,2,1,8,0,0,1,0
533,Girlfriends father has been diagnosed and they live in another country What can I say or do to help her or her family,2,2,7,2,2,8,0,0,1,0
534,As someone with cancer does it annoy you when people who think they might have it come to r cancer I lurk on this sub occasionally and I notice some people seeking reassurance that they don't have cancer or asking what the first symptoms of developing cancer were to compare it to their symptoms etc etc Seems like it's disrespectful to come crying to people already suffering with cancer and probably belongs on r healthanxiety but that's just me (and I do not have cancer ),0,0,0,0,0,0,0,0,0,0
535,immunocal platinum Works Hello Reddit i come here today to ask about this medicine one of my moms relative (she has larynx cancer and spread to all her body so she has now stage 4 cancer) came here telling her that its some miracle medicine that can cure 70% of the patients Thoughts (English its not my first lenguaje sorry in advance),2,1,7,2,1,0,0,0,1,0
536,Comic about cancer Hey all my fellow cancer survivors I've been dealing with brain cancer for almost seven years now Last year I found a very therapeutic way to deal with my feelings about my diagnosis I began to draw a comic about my experiences with cancer It's goal is to bring some humour to the otherwise shitty situation a lot of us have found ourselves in I'm not going to post a link here as I'm not sure if it's against the rules All I want is to hopefully bring a smile to those going through dark times If you or a loved one are going through cancer and might be interested send me a message and I'll send you a link to the instagram page,1,0,0,1,0,0,0,0,0,0
